intent_일시정지_문의_멀티턴	일시정지 두달동안 해주세요				
intent_일시정지_문의_멀티턴	일시정지 두주간 하고싶은데 어떻게 해?				
intent_일시정지_문의_멀티턴	일시정지 모레 시작해서 2주 동안 할게요				
intent_일시정지_문의_멀티턴	일시정지 모레부터 되게 설정해줘				
intent_일시정지_문의_멀티턴	일시정지 반년 하는 법 알려줘				
intent_일시정지_문의_멀티턴	일시정지 반년간 해야합니다				
intent_일시정지_문의_멀티턴	일시정지 반년동안 하고 싶은데 어떻게 해?				
intent_일시정지_문의_멀티턴	일시정지 보름동안 해야하는데 어떻게 해야할까요?				
intent_일시정지_문의_멀티턴	일시정지 보름정도 하고 싶은데 방법 알려주셔				
intent_일시정지_문의_멀티턴	일시정지 사주일간 하고싶습니다				
intent_일시정지_문의_멀티턴	일시정지 삼주 할거야				
intent_일시정지_문의_멀티턴	일시정지 삼주동안 해줘				
intent_일시정지_문의_멀티턴	일시정지 삼주일동안 하고싶은데 방법 알려줘				
intent_일시정지_문의_멀티턴	일시정지 세달 해야하는데 어떻게 해?				
intent_일시정지_문의_멀티턴	일시정지 시작 다음주 토요일부터로 요청합니다				
intent_일시정지_문의_멀티턴	일시정지 시작을 다음주 금요일부터로 설정해도 될까요?				
intent_일시정지_문의_멀티턴	일시정지 시작을 다음주 금요일부터로 하는 걸로 요청합니다				
intent_일시정지_문의_멀티턴	일시정지 시작을 다음주 목요일부터로 설정할 수 있어요?				
intent_일시정지_문의_멀티턴	일시정지 시작을 다음주 목요일부터로 설정할게요				
intent_일시정지_문의_멀티턴	일시정지 시작을 다음주 수요일부터로 설정하고 싶어요				
intent_일시정지_문의_멀티턴	일시정지 시작을 다음주 일요일부터로 설정하려고요				
intent_일시정지_문의_멀티턴	일시정지 시작을 다음주 토요일부터로 설정하고 싶은데요				
intent_일시정지_문의_멀티턴	일시정지 신청 담주 금욜에 해서 두 달 가능? 				
intent_일시정지_문의_멀티턴	일시정지 신청 이달 10일부터 40일 정지가 되나요?				
intent_일시정지_문의_멀티턴	일시정지 신청하고 싶은데 이달 5일부터 두 달간 가능할까				
intent_일시정지_문의_멀티턴	일시정지 여섯달간 하고 싶습니다				
intent_일시정지_문의_멀티턴	일시정지 오늘부터 다음주 금요일까지 휴대폰에 할 수 있나요?	휴대폰	Mobile		
intent_일시정지_문의_멀티턴	일시정지 오늘부터 되게 가능한가요?				
intent_일시정지_문의_멀티턴	일시정지 오늘부터 되게 하고 싶어				
intent_일시정지_문의_멀티턴	일시정지 오늘부터 되도록 신청해줘요.				
intent_일시정지_문의_멀티턴	일시정지 오늘부터 적용되게 신청해주세요				
intent_일시정지_문의_멀티턴	일시정지 요청할게요 6/14까지요				
intent_일시정지_문의_멀티턴	일시정지 이년동안 하고 싶은데 어떻게 해야할까?				
intent_일시정지_문의_멀티턴	일시정지 이번 달 3일부터 되게 해주세요				
intent_일시정지_문의_멀티턴	일시정지 일년 하고 싶은데 어떻게 해야하는지 모르겠어요				
intent_일시정지_문의_멀티턴	일시정지 일년 할 수 있나요?				
intent_일시정지_문의_멀티턴	일시정지 일년 해야하는데 방법쫌 알려주세요				
intent_일시정지_문의_멀티턴	일시정지 일년간 해야하는데 어떻게 하나요				
intent_일시정지_문의_멀티턴	일시정지 일년동안 하고 싶습니다				
intent_일시정지_문의_멀티턴	일시정지 잠깐 좀 신청하려고				
intent_일시정지_문의_멀티턴	일시정지 잠깐 좀 하려는데요				
intent_일시정지_문의_멀티턴	일시정지 절차 좀 도와줘				
intent_일시정지_문의_멀티턴	일시정지 절차가 어떻게 돼요?				
intent_일시정지_문의_멀티턴	일시정지 좀 시켜줘요 담주 목요일까지				
intent_일시정지_문의_멀티턴	일시정지 좀 신청하려고 왔어요				
intent_일시정지_문의_멀티턴	일시정지 좀 하려는데 내일부터 일주일이 가능할까?				
intent_일시정지_문의_멀티턴	일시정지 좀 할게요 다음 주 목요일까지요				
intent_일시정지_문의_멀티턴	일시정지 지금 되나요?				
intent_일시정지_문의_멀티턴	일시정지 지금 바로 할 수 있는지				
intent_일시정지_문의_멀티턴	일시정지 지금 시킬 수 있나요?				
intent_일시정지_문의_멀티턴	일시정지 지금 좀 가능한지요?				
intent_일시정지_문의_멀티턴	일시정지 지금 할 수 있나요?				
intent_일시정지_문의_멀티턴	일시정지 질문입니다				
intent_일시정지_문의_멀티턴	일시정지 팔주 하고싶어				
intent_일시정지_문의_멀티턴	일시정지 팔주일동안 하겠습니다 어떻게 하는지 설명해줘요				
intent_일시정지_문의_멀티턴	일시정지 하고 싶은데 2월 1일부터 1년 기간만큼 하는 법 알려줘.				
intent_일시정지_문의_멀티턴	일시정지 하려고 하는데 내일 시작되도록 할 수 있나 물어보려고				
intent_일시정지_문의_멀티턴	일시정지 하려고 하는데 내일 시작되도록 할 수 있어?				
intent_일시정지_문의_멀티턴	일시정지 하려고 하는데 내일 시작되도록 할 수 있을까요				
intent_일시정지_문의_멀티턴	일시정지 하려고 하는데 내일 시작되도록 해 주세요				
intent_일시정지_문의_멀티턴	일시정지 하려고 하는데 내일 시작하는 걸로 신청하려구요				
intent_일시정지_문의_멀티턴	일시정지 하려고 하는데 내일 시작하는 걸로 할게				
intent_일시정지_문의_멀티턴	일시정지 하려고 하는데 내일 시작하려고				
intent_일시정지_문의_멀티턴	일시정지 하려고 하는데 내일부터 되게 할 수 있을까요?				
intent_일시정지_문의_멀티턴	일시정지 하려고 하는데 내일부터 되도록 할 수도 있나요?				
intent_일시정지_문의_멀티턴	일시정지 하려고 하는데 내일부터 되도록 해 주실 수 있나요?				
intent_일시정지_문의_멀티턴	일시정지 하려고 하는데 내일부터 시작하는 걸로 신청 가능해요?				
intent_일시정지_문의_멀티턴	일시정지 하려고 하는데 내일부터 시작하려구요				
intent_일시정지_문의_멀티턴	일시정지 하려고 하는데 내일부터 시작할 수도 있나요?				
intent_일시정지_문의_멀티턴	일시정지 하려는데 5월 1일부터 30일까지 할 수 있나요?				
intent_일시정지_문의_멀티턴	일시정지 하려는데요 신정부터 20일 동안이요				
intent_일시정지_문의_멀티턴	일시정지 하루동안 해야하는데 방법 알려줘				
intent_일시정지_문의_멀티턴	일시정지 한 달간 하려는데요 8월 1일부터요				
intent_일시정지_문의_멀티턴	일시정지 한달간 해줘				
intent_일시정지_문의_멀티턴	일시정지 해줘 이번주 수요일 기준으로 2주일의 기간만큼.				
intent_일시정지_문의_멀티턴	일시정지 혹시 다음주 월요일부터 금요일까지 돼요?				
intent_일시정지_문의_멀티턴	일시정지를 10일간 할 수 있나요?				
intent_일시정지_문의_멀티턴	일시정지를 2월 4일부터 20일간 할 수 있는지				
intent_일시정지_문의_멀티턴	일시정지를 다음달 10일날 시작하는 걸로 해 줘				
intent_일시정지_문의_멀티턴	일시정지를 다음달 11일날 시작하는 걸로 도와주실래요				
intent_일시정지_문의_멀티턴	일시정지를 다음달 12일날 시작하는 걸로 신청 부탁드려요				
intent_일시정지_문의_멀티턴	일시정지를 다음달 13일날 시작하도록 신청할게요				
intent_일시정지_문의_멀티턴	일시정지를 다음달 3일부터 되도록 예약하려면?				
intent_일시정지_문의_멀티턴	일시정지를 다음달 3일부터 시작하는 걸로 신청 가능한지?				
intent_일시정지_문의_멀티턴	일시정지를 다음달 5일부터도 되게 할 수 있나요?				
intent_일시정지_문의_멀티턴	일시정지를 다음달 9일부터 할 수 있어?				
intent_일시정지_문의_멀티턴	일시정지를 다음달 말일 날부터 되도록 설정하려면?				
intent_일시정지_문의_멀티턴	일시정지를 다음달 시작으로 둘째 주 화요일날에 신청할 수 있나?				
intent_일시정지_문의_멀티턴	일시정지를 다음달 첫째주 월요일 부터 되게 하려면?				
intent_일시정지_문의_멀티턴	일시정지를 다음달부터 3일에 시작하려면 어떻게 해야 하나요?				
intent_일시정지_문의_멀티턴	일시정지를 다음달부터 5일에 시작하려면 어떻게 하면 될까요?				
intent_일시정지_문의_멀티턴	일시정지를 다음달부터 7일에 시작하려면 어떻게 하면 될지요				
intent_일시정지_문의_멀티턴	일시정지를 다음달부터 9일에 시작하려면 어떻게 해야 하는지 알려주세요				
intent_일시정지_문의_멀티턴	일시정지를 다음달부터 첫째 주 월요일에 시작할 수 있을까?				
intent_일시정지_문의_멀티턴	일시정지를 이번 달 9일에 신청하고 2주만큼 해주라.				
intent_일시정지_문의_멀티턴	일시정지를 익월 2일부터 30일 동안 할 수 있나요?				
intent_일시정지_문의_멀티턴	일시정지를 하려는데 9월 9일 한 달간 가능한지 알려줘				
intent_일시정지_문의_멀티턴	일시정지를 한달동안 하고 싶은데요.				
intent_일시정지_문의_멀티턴	일시정지에 대한 사항 좀 알려주세요				
intent_일시정지_문의_멀티턴	일시정지에 대해서요				
intent_일시정지_문의_멀티턴	일시정지하는 것 질문이요				
intent_일시정지_문의_멀티턴	일시정지하려고 하는데 내일 시작하는 것도 가능해요?				
intent_일시정지_문의_멀티턴	일시정지할 건데 1월 1일 담달부터로 신청할게				
intent_일시정지_문의_멀티턴	일시정지할 건데 2월 2일 담달부터로 신청해 줘				
intent_일시정지_문의_멀티턴	일시정지할 건데 3월 28일인 담달부터 할 수 있을까요?				
intent_일시정지_문의_멀티턴	일시정지할 건데 3월 3일 담달부터로 하려고				
intent_일시정지_문의_멀티턴	일시정지할 건데 4월 4일 담달부터로도 될까요?				
intent_일시정지_문의_멀티턴	일시정지할 건데 6월 22일인 담달부터로 신청하려구요				
intent_일시정지_문의_멀티턴	일시정지할 건데 다음주 목요일인 담달부터로도 되나 여쭤보려구요				
intent_일시정지_문의_멀티턴	일시정지할 건데 담달 1일부터로도 신청 가능한가?				
intent_일시정지_문의_멀티턴	일시정지할 건데 담달 2일부터로도 돼요?				
intent_일시정지_문의_멀티턴	일시정지할 건데 담달 3일부터로도 신청되나 해서요				
intent_일시정지_문의_멀티턴	일시정지할 건데 담달 이월 이일부터로 해 주실 수 있나요?				
intent_일시정지_문의_멀티턴	일시정지할 건데 담달 일월 일일부터로 해 줘				
intent_일시정지_문의_멀티턴	일시정지할 건데 담달부터로 5월 5일로 신청할 수 있어요?				
intent_일시정지_문의_멀티턴	일시정지할 건데 담달부터로도 삼월 삼일에 할 수 있어요?				
intent_일시정지_문의_멀티턴	일시정지할게 7월 20까지	폰	Mobile		
intent_일시정지_문의_멀티턴	일요일까지 일시정지 가능해?				
intent_일시정지_문의_멀티턴	일요일부터 한달 동안 일시정지 하고싶은데 알려줘.				
intent_일시정지_문의_멀티턴	일주간 정지 신청해주세요.				
intent_일시정지_문의_멀티턴	일주동안 일시정지 하고 싶은데 어떻게 해요?				
intent_일시정지_문의_멀티턴	일주일 뒤까지 폰 정지	폰	Mobile		
intent_일시정지_문의_멀티턴	일주일간 일시정지 신청하는 방법				
intent_일시정지_문의_멀티턴	일주일간 일시정지 하고 싶어.				
intent_일시정지_문의_멀티턴	일지 정지 어떻게 해?				
intent_일시정지_문의_멀티턴	잠깐동안 가입한 상품 사용 정지하고 싶어서요				
intent_일시정지_문의_멀티턴	잠깐동안 서비스들 일시 정지시키고 싶은데요				
intent_일시정지_문의_멀티턴	잠깐동안 일시정지 하고 싶어서요				
intent_일시정지_문의_멀티턴	잠시 동안 사용 중이던 것들 일시 정지 시키려는데요				
intent_일시정지_문의_멀티턴	잠시 동안 사용 중이던 상품 이용 중지하려는데				
intent_일시정지_문의_멀티턴	잠시 일시 정지 좀 신청하려는데요				
intent_일시정지_문의_멀티턴	잠시 핸드폰 일시정지 하고 싶어요	핸드폰	Mobile		
intent_일시정지_문의_멀티턴	잠시 핸드폰 정지시키고 싶어	핸드폰	Mobile		
intent_일시정지_문의_멀티턴	잠시 핸드폰 정지시키고 싶은데요	핸드폰	Mobile		
intent_일시정지_문의_멀티턴	잠시 핸드폰 정지시키려면 어떻게 해야 되죠?	핸드폰	Mobile		
intent_일시정지_문의_멀티턴	잠시 핸드폰 정지시키려면 제가 어떻게 하면 되나요	핸드폰	Mobile		
intent_일시정지_문의_멀티턴	잠시 핸드폰 정지시킬 수 있어?	핸드폰	Mobile		
intent_일시정지_문의_멀티턴	잠시 핸드폰 정지시킬 수 있을까요?	핸드폰	Mobile		
intent_일시정지_문의_멀티턴	잠시 핸드폰 정지시킬 수 있을까요?	핸드폰	Mobile		
intent_일시정지_문의_멀티턴	잠시 핸드폰 정지시킬게	핸드폰	Mobile		
intent_일시정지_문의_멀티턴	잠시 핸드폰 회선을 중단시켜두려고 하는데 어떻게 하는 건지를 모르겠어요	핸드폰	Mobile		
intent_일시정지_문의_멀티턴	잠시 핸드폰을 정지시켜 두고 싶은데 어떻게 하면 될지요	핸드폰	Mobile		
intent_일시정지_문의_멀티턴	저 다음달 첫째 주 화요일로 일시정지되도록 요청드려요				
intent_일시정지_문의_멀티턴	저 정지 10월 11일인 담주부터 하게 해 주세요				
intent_일시정지_문의_멀티턴	저 정지 담주 1일부터 시작할 수도 있어요?				
intent_일시정지_문의_멀티턴	저 정지 담주 2일부터 시작되게 신청할 수도 있나요?				
intent_일시정지_문의_멀티턴	저 정지 담주 금요일부터 시작되게 해 주세요				
intent_일시정지_문의_멀티턴	저 정지 담주 수요일부터 하도록 설정해 주세요				
intent_일시정지_문의_멀티턴	저 정지 담주 월요일에 시작하는 걸로 해주실 수 있나요?				
intent_일시정지_문의_멀티턴	저 정지 담주 화요일에 시작하는 걸로 해 주세요				
intent_일시정지_문의_멀티턴	저 핸드폰 6월 1일부터 6월 30일까지 일시정지하려는데요	핸드폰	Mobile		
intent_일시정지_문의_멀티턴	정시 시작일을 다음달 첫주 월요일부터로 할게요				
intent_일시정지_문의_멀티턴	정지 시작을 다음달 14일부터로 할 수 있나 여쭤보려구요				
intent_일시정지_문의_멀티턴	정지 시작을 다음달 1일부터로 할래				
intent_일시정지_문의_멀티턴	정지 시작을 다음달 둘째 주 11일부터 해 주세요				
intent_일시정지_문의_멀티턴	정지 시작을 다음달 첫주 3일부터로 설정할게요				
intent_일시정지_문의_멀티턴	정지 시작을 다음달 초 2일부터로 할 수 있을까?				
intent_일시정지_문의_멀티턴	정지 시작일을 다음달 1일부터로 할 수 있나?				
intent_일시정지_문의_멀티턴	정지 시작일을 다음달 첫 월요일부터로 해 주세요				
intent_일시정지_문의_멀티턴	정지 시작하는 거를 다음주 수요일로 할려구요				
intent_일시정지_문의_멀티턴	정지 시작하는 거를 다음주 월요일로 할 수 있을까요?				
intent_일시정지_문의_멀티턴	정지 시작하는 거를 다음주 화요일로 해 주세요				
intent_일시정지_문의_멀티턴	제 폰 다음달 17일부터 일시정지되게 신청합니다	폰	Mobile		
intent_일시정지_문의_멀티턴	제 폰 다음주 월요일부터 일시정지 할 수 있나요?	폰	Mobile		
intent_일시정지_문의_멀티턴	제 폰 일시정지 내일부터 하려면 어떻게 해요?	폰	Mobile		
intent_일시정지_문의_멀티턴	제 핸드폰 1월 1일부터 2월 15일까지 잠깐 정지 부탁해요	핸드폰	Mobile		
intent_일시정지_문의_멀티턴	제 핸드폰 4월 5일부터 5월 5일까지 한 달 간 정지시키려면 어떻게 해요?	핸드폰	Mobile		
intent_일시정지_문의_멀티턴	제 핸드폰 5월 4일부터 6월 13일까지 일시정지시켜주세요	핸드폰	Mobile		
intent_일시정지_문의_멀티턴	제 핸드폰 다음달 24일부터 일시정지되게 해 주세요	핸드폰	Mobile		
intent_일시정지_문의_멀티턴	제 핸드폰 다음주 월요일부터 일시정지 시켜주세요	핸드폰	Mobile		
intent_일시정지_문의_멀티턴	제 핸드폰 다음주 일요일부터 일시정지 되나요?	핸드폰	Mobile		
intent_일시정지_문의_멀티턴	제 핸드폰 정지시키고 싶은데 어떻게 해야 되나요?	핸드폰	Mobile		
intent_일시정지_문의_멀티턴	제 핸드폰 정지시키려고 해요	핸드폰	Mobile		
intent_일시정지_문의_멀티턴	제 휴대폰 일시정지 하려면 어떻게 해야 하나요?	휴대폰	Mobile		
intent_일시정지_문의_멀티턴	제가 6/14까지 일시정지를 하고 싶어요				
intent_일시정지_문의_멀티턴	제가 가입한 서비스들 일시정지 어디서 시키나요?				
intent_일시정지_문의_멀티턴	제가 내일부터 폰 사용 정지해야 하는데요	폰	Mobile		
intent_일시정지_문의_멀티턴	제가 내일부터 폰 사용 정지해야 해요	폰	Mobile		
intent_일시정지_문의_멀티턴	제가 잠깐 핸드폰을 못 쓸 것 같아서 일시정지 신청하려는데 어떻게 하면 되나요?	핸드폰	Mobile		
intent_일시정지_문의_멀티턴	제가 잠깐 핸드폰을 못 쓸 것 같아서 잠깐 정지해두려고 하는데 어떻게 하면 되나요?	핸드폰	Mobile		
intent_일시정지_문의_멀티턴	주말까지 폰 정지하는 방법 가르쳐주세요	폰	Mobile		
intent_일시정지_문의_멀티턴	주말까지 폰 정지하려면 어디로 가야 할까요?	폰	Mobile		
intent_일시정지_문의_멀티턴	주말까지 폰 정지하자	폰	Mobile		
intent_일시정지_문의_멀티턴	주말에 폰 정지 가능할까요?	폰	Mobile		
intent_일시정지_문의_멀티턴	지금 바로 일시정지 가능한지요?				
intent_일시정지_문의_멀티턴	지금 쓰는 폰 5월 4일부터 5월 19일까지 일시정지 하는 것 좀 도와줘	폰	Mobile		
intent_일시정지_문의_멀티턴	지금 일시정지 가능한지 알려줘				
intent_일시정지_문의_멀티턴	지금 일시정지 신청할 수 있어?				
intent_일시정지_문의_멀티턴	지금 일시정지 할 수 있는지?				
intent_일시정지_문의_멀티턴	지금부터 가입상품 잠깐 정지시키는 법				
intent_일시정지_문의_멀티턴	지금부터 가입한 상품 잠깐동안 정지하려면?				
intent_일시정지_문의_멀티턴	지금부터 가입한 상품 좀 일시정지하려는데				
intent_일시정지_문의_멀티턴	지금부터 일시중지 시키고 싶은데요				
intent_일시정지_문의_멀티턴	지금부터 일시중지 하려면 어떻게 해?				
intent_일시정지_문의_멀티턴	지금부터 폰 정지시키는 법 가르쳐줘	폰	Mobile		
intent_일시정지_문의_멀티턴	지금부터 폰 정지시키는 법 알 수 있어?	폰	Mobile		
intent_일시정지_문의_멀티턴	지금부터 폰 정지시키는 법 알아보려고 해요	폰	Mobile		
intent_일시정지_문의_멀티턴	지금부터 폰 정지시키는 법 좀 알아보고 싶어서요	폰	Mobile		
intent_일시정지_문의_멀티턴	지금부터 폰 정지시키는 법도 알려주나요?	폰	Mobile		
intent_일시정지_문의_멀티턴	지금부터 폰 정지시키는 법이 어떻게 되나요	폰	Mobile		
intent_일시정지_문의_멀티턴	지금부터 폰 정지시키는 법이 어떻게 되려나	폰	Mobile		
intent_일시정지_문의_멀티턴	지금부터 핸드폰 일시정지 신청 좀 해줄래	핸드폰	Mobile		
intent_일시정지_문의_멀티턴	지금부터 핸드폰 일시정지 신청 좀 해줘	핸드폰	Mobile		
intent_일시정지_문의_멀티턴	지금부터 핸드폰 일시정지 신청하고 싶어	핸드폰	Mobile		
intent_일시정지_문의_멀티턴	지금부터 핸드폰 일시정지 신청하려고	핸드폰	Mobile		
intent_일시정지_문의_멀티턴	지금부터 핸드폰 일시정지 신청하려고 하는데	핸드폰	Mobile		
intent_일시정지_문의_멀티턴	지금부터 핸드폰 일시정지 신청할 수 있어?	핸드폰	Mobile		
intent_일시정지_문의_멀티턴	칠월부터 네 달 동안 일시정지 좀 부탁해요				
intent_일시정지_문의_멀티턴	칠일동안 일시정지 하는 법 알려주세요				
intent_일시정지_문의_멀티턴	칠주 일시정지 신청합니다				
intent_일시정지_문의_멀티턴	통신사 일시정지 하고 싶어요				
intent_일시정지_문의_멀티턴	팔 개월 정도 일시정지 할 건데 3.10부터 시작해도 돼요?				
intent_일시정지_문의_멀티턴	팔일 일시정지 하고 싶은데 어떻게 해야하는지 모르겠어				
intent_일시정지_문의_멀티턴	폰 1일간 일시정지 신청해주세요	폰	Mobile		
intent_일시정지_문의_멀티턴	폰 22일까지 정지하고 싶은데	폰	Mobile		
intent_일시정지_문의_멀티턴	폰 22일까지 정지하고 싶은데 방법 좀 알려줘	폰	Mobile		
intent_일시정지_문의_멀티턴	폰 22일까지 정지할게	폰	Mobile		
intent_일시정지_문의_멀티턴	폰 29일까지 정지 좀 하고 싶어				
intent_일시정지_문의_멀티턴	폰 29일까지 정지 좀 할래				
intent_일시정지_문의_멀티턴	폰 6월 1일부터 10월 9일까지 정지 원합니다	폰	Mobile		
intent_일시정지_문의_멀티턴	폰 7월 1일부로 일시정지 시킬래요	폰	Mobile		
intent_일시정지_문의_멀티턴	폰 8/14까지 정지하고 싶다	폰	Mobile		
intent_일시정지_문의_멀티턴	폰 내일부터 정지하려면 뭐 어떻게 하나요?	폰	Mobile		
intent_일시정지_문의_멀티턴	폰 사흘간 일시정지 어떻게 할까요	폰	Mobile		
intent_일시정지_문의_멀티턴	폰 십오일동안 안 쓰고 싶은데 일시정지 어떻게 신청하나요	폰	Mobile		
intent_일시정지_문의_멀티턴	폰 십일일간 일시정지 신청해주세요	폰	Mobile		
intent_일시정지_문의_멀티턴	폰 오일동안 안 쓰고 싶은데 일시정지 어떻게 신청하나요	폰	Mobile		
intent_일시정지_문의_멀티턴	폰 이번 목요일부터 사흘 동안만 일시정지 걸어주세요				
intent_일시정지_문의_멀티턴	폰 일년동안 일시정지 하는 법 알려줘	폰	Mobile		
intent_일시정지_문의_멀티턴	폰 일시정지 26일부터 다음달 6일까지 되게 할 수 있어?	폰	Mobile		
intent_일시정지_문의_멀티턴	폰 일시정지 5.21까지 신청하고 싶어	폰	Mobile		
intent_일시정지_문의_멀티턴	폰 일시정지 5.21까지 신청하기	폰	Mobile		
intent_일시정지_문의_멀티턴	폰 일시정지 5.21까지 신청할래	폰	Mobile		
intent_일시정지_문의_멀티턴	폰 일시정지 8/14까지 해줘	폰	Mobile		
intent_일시정지_문의_멀티턴	폰 일시정지 네달동안 유지하고 싶은데 신청해줘	폰	Mobile		
intent_일시정지_문의_멀티턴	폰 일시정지 두달동안 해주세요	폰	Mobile		
intent_일시정지_문의_멀티턴	폰 일시정지 신청은 어디에서 받아주는 건가요?	폰	Mobile		
intent_일시정지_문의_멀티턴	폰 일시정지 신청은 어디에서 해주는 거에요?	폰	Mobile		
intent_일시정지_문의_멀티턴	폰 일시정지는 어디에서 받아줘요?	폰	Mobile		
intent_일시정지_문의_멀티턴	폰 일시정지는 어디에서 하는 거예요?	폰	Mobile		
intent_일시정지_문의_멀티턴	폰 일시정지는 어디에서 해주나요?	폰	Mobile		
intent_일시정지_문의_멀티턴	폰 정지 10일부터 31일까지로 하고 싶은데 방법 알려줘요	폰	Mobile		
intent_일시정지_문의_멀티턴	폰 정지 1월 1일부터 3월 1일까지	폰	Mobile		
intent_일시정지_문의_멀티턴	폰 정지 22일까지 좀 하자	폰	Mobile		
intent_일시정지_문의_멀티턴	폰 정지 8/14까지	폰	Mobile		
intent_일시정지_문의_멀티턴	폰 정지 8/14까지 신청해요	폰	Mobile		
intent_일시정지_문의_멀티턴	폰 정지 금요일까지 하고 싶은데 어떻게 할 수 있을까?	폰	Mobile		
