intent_일시정지_문의_멀티턴	다음 주 금요일부터 휴대폰 사용 정지하기	휴대폰	Mobile		
intent_일시정지_문의_멀티턴	다음 주 목요일부터 내 폰 정지시키려면 어떻게 하냐	폰	Mobile		
intent_일시정지_문의_멀티턴	다음 주 목요일부터 휴대폰 일시중지해도 돼?	휴대폰	Mobile		
intent_일시정지_문의_멀티턴	다음 주 목요일을 끝으로 일시정지 신청 좀 할게요				
intent_일시정지_문의_멀티턴	다음 주 수요일날부터 일 주간 일시정지 신청				
intent_일시정지_문의_멀티턴	다음 주 수요일부터 내 폰 정지시킬거야	폰	Mobile		
intent_일시정지_문의_멀티턴	다음 주 수요일부터 두 달간 일시정지 신청하고 싶어				
intent_일시정지_문의_멀티턴	다음 주 수요일부터 핸드폰 사용 일시 정지 돼?	핸드폰	Mobile		
intent_일시정지_문의_멀티턴	다음 주 수요일부터 핸드폰 사용 일시 정지 어떻게 하는 거야	핸드폰	Mobile		
intent_일시정지_문의_멀티턴	다음 주 수요일부터 핸드폰 사용 일시 정지 어떻게 해?	핸드폰	Mobile		
intent_일시정지_문의_멀티턴	다음 주 수요일부터 핸드폰 사용 일시 정지하고 싶어	핸드폰	Mobile		
intent_일시정지_문의_멀티턴	다음 주 수요일부터 핸드폰 사용 일시 정지할 거야	핸드폰	Mobile		
intent_일시정지_문의_멀티턴	다음 주 수요일부터 핸드폰 이용 일시 정지하려고	핸드폰	Mobile		
intent_일시정지_문의_멀티턴	다음 주 수요일부터 핸드폰 이용을 일시 정지하겠습니다	핸드폰	Mobile		
intent_일시정지_문의_멀티턴	다음 주 수요일부터 휴대폰 잠깐 사용 정지할래	휴대폰	Mobile		
intent_일시정지_문의_멀티턴	다음 주 수욜부터 휴대폰 일시중지 할게	휴대폰	Mobile		
intent_일시정지_문의_멀티턴	다음 주 월요일 시작으로 팔 일간 일시정지 할게				
intent_일시정지_문의_멀티턴	다음 주 월요일날부터 핸드폰 정지해두려고요	핸드폰	Mobile		
intent_일시정지_문의_멀티턴	다음 주 월요일부터 핸드폰 일시정지	핸드폰	Mobile		
intent_일시정지_문의_멀티턴	다음 주 월요일부터 핸드폰 일시정지 돼?	핸드폰	Mobile		
intent_일시정지_문의_멀티턴	다음 주 월요일부터 핸드폰 일시정지하기	핸드폰	Mobile		
intent_일시정지_문의_멀티턴	다음 주 월요일부터 휴대폰 사용을 잠시 중단하겠습니다	휴대폰	Mobile		
intent_일시정지_문의_멀티턴	다음 주 월요일부터 휴대폰 일시 정지하고 싶어	휴대폰	Mobile		
intent_일시정지_문의_멀티턴	다음 주 월욜부터 핸드폰 일시정지 신청	핸드폰	Mobile		
intent_일시정지_문의_멀티턴	다음 주 월욜부터 핸드폰 일시정지 신청 가능해?	핸드폰	Mobile		
intent_일시정지_문의_멀티턴	다음 주 월욜부터 핸드폰 일시정지 신청하려고 해	핸드폰	Mobile		
intent_일시정지_문의_멀티턴	다음 주 월욜부터 핸드폰 일시정지 신청해도 될까?	핸드폰	Mobile		
intent_일시정지_문의_멀티턴	다음 주 월욜부터 핸드폰 일시정지 할거야	핸드폰	Mobile		
intent_일시정지_문의_멀티턴	다음 주 월욜부터 핸드폰 일시정지하자	핸드폰	Mobile		
intent_일시정지_문의_멀티턴	다음 주 월욜부터 휴대폰 정지시킬 수 있나요?	휴대폰	Mobile		
intent_일시정지_문의_멀티턴	다음 주 일요일날부터 폰을 좀 정지시켜 두려고 하는데 신청하는 방법을 좀 알고 싶어요	폰	Mobile		
intent_일시정지_문의_멀티턴	다음 주 일요일부터 폰 정지시킬 건데 어디에 요청하면 되니	폰	Mobile		
intent_일시정지_문의_멀티턴	다음 주 일요일부터 휴대폰 일시 정지하길 원해요	휴대폰	Mobile		
intent_일시정지_문의_멀티턴	다음 주 일요일부터 휴대폰 일시 정지하려면?	휴대폰	Mobile		
intent_일시정지_문의_멀티턴	다음 주 주말부터 핸드폰 일시정지 설정해 둬	핸드폰	Mobile		
intent_일시정지_문의_멀티턴	다음 주 주말부터 휴대폰 일시 정지시킬게요	휴대폰	Mobile		
intent_일시정지_문의_멀티턴	다음 주 주말부터 휴대폰 일시 정지하려고 합니다	휴대폰	Mobile		
intent_일시정지_문의_멀티턴	다음 주 주말부터 휴대폰 일시 정지할 수 있는 거지?	휴대폰	Mobile		
intent_일시정지_문의_멀티턴	다음 주 주말부터 휴대폰 일시 정지할게요	휴대폰	Mobile		
intent_일시정지_문의_멀티턴	다음 주 토요일부터 제 폰 정지시키려고 하는데 어디서 신청하면 돼요?	폰	Mobile		
intent_일시정지_문의_멀티턴	다음 주 토요일부터 휴대폰 일시 정지하도록 도와줘요	휴대폰	Mobile		
intent_일시정지_문의_멀티턴	다음 주 화요일부터 내 폰 정지시킬래	폰	Mobile		
intent_일시정지_문의_멀티턴	다음 주 화요일부터 휴대폰 사용을 잠시 중단해도 될까요?	휴대폰	Mobile		
intent_일시정지_문의_멀티턴	다음 주 화요일부터 휴대폰 일시정지하게 도와줘	휴대폰	Mobile		
intent_일시정지_문의_멀티턴	다음달 10월 5일을 시작으로 정지 신청하는 방법 궁금해				
intent_일시정지_문의_멀티턴	다음달 10일까지 휴대폰 정지시켜	휴대폰	Mobile		
intent_일시정지_문의_멀티턴	다음달 10일까지 휴대폰 정지해 줘	휴대폰	Mobile		
intent_일시정지_문의_멀티턴	다음달 10일을 시작으로 일시정지되게 해 줘				
intent_일시정지_문의_멀티턴	다음달 10일을 시작으로 정지하려면 어떻게 해요?				
intent_일시정지_문의_멀티턴	다음달 12일부터 일시정지 되게 신청 좀 				
intent_일시정지_문의_멀티턴	다음달 13일부터 일시정지 부탁합니다				
intent_일시정지_문의_멀티턴	다음달 16일부터 일시정지 할게요				
intent_일시정지_문의_멀티턴	다음달 17일 부로 핸드폰 일시정지 예약 좀 해주세요	핸드폰	Mobile		
intent_일시정지_문의_멀티턴	다음달 19일부터 일시정지 시키겠습니다				
intent_일시정지_문의_멀티턴	다음달 1일 날부터 일시정지시켜주세요				
intent_일시정지_문의_멀티턴	다음달 1일 목요일을 시작으로 정지 신청하는 방법 알려주실 수 있나요				
intent_일시정지_문의_멀티턴	다음달 1일 부터 일시정지 하려면?				
intent_일시정지_문의_멀티턴	다음달 1일 시작으로 일시정지 설정되게 신청해줘				
intent_일시정지_문의_멀티턴	다음달 1일 초부터 31일 말까지 핸드폰 일시정지 좀	핸드폰	Mobile		
intent_일시정지_문의_멀티턴	다음달 1일부터 일시정지				
intent_일시정지_문의_멀티턴	다음달 1일부터 일시정지되게 설정할 수 있나요?				
intent_일시정지_문의_멀티턴	다음달 1일부터 일시정지되게 예약 되나요?				
intent_일시정지_문의_멀티턴	다음달 1일부터 일시정지시켜줘				
intent_일시정지_문의_멀티턴	다음달 1일부터 휴대폰 일시정지 되도록 해주세요	휴대폰	Mobile		
intent_일시정지_문의_멀티턴	다음달 1일을 시작으로 일시정지 설정				
intent_일시정지_문의_멀티턴	다음달 20일을 시작으로 정지할 수 있나 문의드려요				
intent_일시정지_문의_멀티턴	다음달 21일날부터 일시정지 하려고요				
intent_일시정지_문의_멀티턴	다음달 23일날부터 일시정지시키고 싶어				
intent_일시정지_문의_멀티턴	다음달 27일 날부터 일시정지되게 하고 싶어				
intent_일시정지_문의_멀티턴	다음달 2일부터 일시정지 하고 싶습니다				
intent_일시정지_문의_멀티턴	다음달 2일부터 일시정지 하려면 뭐 어떻게 해?				
intent_일시정지_문의_멀티턴	다음달 2일에 일시정지 신청하려는데 5일 동안 가능한지				
intent_일시정지_문의_멀티턴	다음달 2일을 시작으로 일시정지 신청하려구요				
intent_일시정지_문의_멀티턴	다음달 30일날부터 일시정지 좀 하고 싶어요				
intent_일시정지_문의_멀티턴	다음달 3일부터 9일까지 일시정지				
intent_일시정지_문의_멀티턴	다음달 3일부터 일시정지 하려면 어떻게 하는 건지?				
intent_일시정지_문의_멀티턴	다음달 3일부터 일시정지 할래				
intent_일시정지_문의_멀티턴	다음달 3일부터 일시정지해줘				
intent_일시정지_문의_멀티턴	다음달 4일 부로 핸드폰 일시정지 되게 예약	핸드폰	Mobile		
intent_일시정지_문의_멀티턴	다음달 4일부터 3주 동안 일시정지 신청				
intent_일시정지_문의_멀티턴	다음달 4일부터 일시정지 되도록 신청 좀 해주라				
intent_일시정지_문의_멀티턴	다음달 4일부터 일시정지 신청				
intent_일시정지_문의_멀티턴	다음달 4일을 시작으로 일시정지 설정할래요				
intent_일시정지_문의_멀티턴	다음달 5일부터 일시정지 신청합니다				
intent_일시정지_문의_멀티턴	다음달 5일에 핸드폰 일시정지 해야 되는데 도와줘	핸드폰	Mobile		
intent_일시정지_문의_멀티턴	다음달 5일을 시작으로 일시정지 할 수 있죠?				
intent_일시정지_문의_멀티턴	다음달 6일부터 일시정지 신청 좀 해줘				
intent_일시정지_문의_멀티턴	다음달 6일을 시작으로 일시정지 할게요				
intent_일시정지_문의_멀티턴	다음달 7일부터 일시정지 되도록 신청 부탁해요				
intent_일시정지_문의_멀티턴	다음달 7일을 시작으로 일시정지 신청합니다				
intent_일시정지_문의_멀티턴	다음달 8일부터 폰 일시정지 신청 부탁해	폰	Mobile		
intent_일시정지_문의_멀티턴	다음달 8일부터 폰 일시정지 신청 좀 해 줘	폰	Mobile		
intent_일시정지_문의_멀티턴	다음달 8일부터 폰 일시정지되게 신청해 놔	폰	Mobile		
intent_일시정지_문의_멀티턴	다음달 8일을 시작으로 일시정지 신청				
intent_일시정지_문의_멀티턴	다음달 9일부터 15일까지 일시정지 부탁합니다				
intent_일시정지_문의_멀티턴	다음달 9일을 시작으로 일시정지되게 해 주세요				
intent_일시정지_문의_멀티턴	다음달 둘째 주 화요일부터 일시정지 신청하자				
intent_일시정지_문의_멀티턴	다음달 둘째 주 화요일을 시작으로 정지할 수 있나?				
intent_일시정지_문의_멀티턴	다음달 셋째 주 수요일을 시작으로 정지 설정 가능한가요?				
intent_일시정지_문의_멀티턴	다음달 셋째날에 일시정지 두 달 신청할 수 있나?				
intent_일시정지_문의_멀티턴	다음달 시작하고 한 달 동안만 일시정지 신청 부탁해				
intent_일시정지_문의_멀티턴	다음달 첫 월요일을 시작으로 정지 신청하는 방법 안내 부탁해				
intent_일시정지_문의_멀티턴	다음달 첫 화요일을 시작으로 정지 신청하는 방법 안내해 줘				
intent_일시정지_문의_멀티턴	다음달 첫째 주 월요일부터 삼개월 일시정지 신청				
intent_일시정지_문의_멀티턴	다음달 첫째 주 월요일부터 일시정지 신청할게				
intent_일시정지_문의_멀티턴	다음달 첫째 주 월요일을 시작으로 일시정지 되도록 신청				
intent_일시정지_문의_멀티턴	다음달인 2월 4일을 시작으로 정지 신청하는 방법 알려주세요				
intent_일시정지_문의_멀티턴	다음주 11일을 시작 일자로 핸드폰을 정지하겠습니다	핸드폰	Mobile		
intent_일시정지_문의_멀티턴	다음주 11일을 시작으로 핸드폰 정지 좀	핸드폰	Mobile		
intent_일시정지_문의_멀티턴	다음주 13일부터 일시정지 하는 방법 궁금해요.				
intent_일시정지_문의_멀티턴	다음주 13일부터 일시중지 하는 방법				
intent_일시정지_문의_멀티턴	다음주 15일 월요일부터 일시중지 하는 방법 알려주세요				
intent_일시정지_문의_멀티턴	다음주 17일 수요일부터 일시중지 하는 방법 좀 알려주세요				
intent_일시정지_문의_멀티턴	다음주 18일부터 일시중지 할 수 있어?				
intent_일시정지_문의_멀티턴	다음주 19일 금요일부터 일시중지 하는 방법 좀 알려주라				
intent_일시정지_문의_멀티턴	다음주 21일 일요일부터 일시중지 하는 방법 알려주실 수 있나요?				
intent_일시정지_문의_멀티턴	다음주 금요일까지 일시정지 되도록 적용				
intent_일시정지_문의_멀티턴	다음주 금요일까지 일시정지 적용되도록 신청				
intent_일시정지_문의_멀티턴	다음주 금요일부터 일시중지 할 수 있지?				
intent_일시정지_문의_멀티턴	다음주 금요일에서부터 보름의 기간만큼 일시정지 해주세요.				
intent_일시정지_문의_멀티턴	다음주 금욜부터 일시중지 하는 법을 알려주세요				
intent_일시정지_문의_멀티턴	다음주 목부터 일시정지 하는 방법				
intent_일시정지_문의_멀티턴	다음주 목요일 날부터 일시중지 하려면 어디서 하나요?				
intent_일시정지_문의_멀티턴	다음주 목요일까지 일시정지 하는 방법 알려주라				
intent_일시정지_문의_멀티턴	다음주 목요일부터 일시중지 하는 방법 좀				
intent_일시정지_문의_멀티턴	다음주 목요일부터 일시중지 할래				
intent_일시정지_문의_멀티턴	다음주 수요일부터 금요일까지 일시정지 해놓기				
intent_일시정지_문의_멀티턴	다음주 수요일부터 일시정지 되도록 요청 좀 할게요				
intent_일시정지_문의_멀티턴	다음주 수요일부터 일시정지 시작하자				
intent_일시정지_문의_멀티턴	다음주 수요일부터 일시정지되게 해주세요				
intent_일시정지_문의_멀티턴	다음주 수요일부터 일시중지 하려구				
intent_일시정지_문의_멀티턴	다음주 월까지 일시정지 하는 방법				
intent_일시정지_문의_멀티턴	다음주 월부터 금까지 일시정지하기				
intent_일시정지_문의_멀티턴	다음주 월요일 부로 핸드폰 일시정지 되게 설정	핸드폰	Mobile		
intent_일시정지_문의_멀티턴	다음주 월요일날부터 금요일날까지 잠깐 정지해놓으려는데요				
intent_일시정지_문의_멀티턴	다음주 월요일부터 금요일까지 일시정지해 줘				
intent_일시정지_문의_멀티턴	다음주 월요일부터 금요일까지 핸드폰 일시정지 신청하겠습니다	핸드폰	Mobile		
intent_일시정지_문의_멀티턴	다음주 월요일부터 다음주 금요일까지 일시정지 해놔				
intent_일시정지_문의_멀티턴	다음주 월요일부터 일시정지 1달간 부탁합니다				
intent_일시정지_문의_멀티턴	다음주 월요일부터 일시정지 되도록 요청드려요				
intent_일시정지_문의_멀티턴	다음주 월요일부터 일시정지 시작				
intent_일시정지_문의_멀티턴	다음주 월요일부터 일시정지 하는 방법				
intent_일시정지_문의_멀티턴	다음주 월요일부터 일시중지 하려면 어떻게 하면 될지요?				
intent_일시정지_문의_멀티턴	다음주 월요일부터 일시중지 하려면 어떻게 해?				
intent_일시정지_문의_멀티턴	다음주 월요일부터 일주일간 일시정지 해줘.				
intent_일시정지_문의_멀티턴	다음주 월요일부터 토요일까지 폰 일시정지하기	폰	Mobile		
intent_일시정지_문의_멀티턴	다음주 월요일을 기준으로 10일 동안 일시정지 방법 알려줘				
intent_일시정지_문의_멀티턴	다음주 일요일부터 일시정지 되도록 하려구요				
intent_일시정지_문의_멀티턴	다음주 일요일부터 일시정지 부탁합니다.				
intent_일시정지_문의_멀티턴	다음주 일요일부터 일시정지 시작하기				
intent_일시정지_문의_멀티턴	다음주 일요일부터 일시중지 어떻게 하는지 알려주세요.				
intent_일시정지_문의_멀티턴	다음주 일요일부터 일시중지 하려면 어떻게 하는 거야?				
intent_일시정지_문의_멀티턴	다음주 일요일부터 일시중지 할 수 있나요?				
intent_일시정지_문의_멀티턴	다음주 주말부터 일시정지 좀 부탁합니다				
intent_일시정지_문의_멀티턴	다음주 주말부터 일시중지 하는 방법 궁금해				
intent_일시정지_문의_멀티턴	다음주 주말부터 일시중지할려면 어떻게 해요?				
intent_일시정지_문의_멀티턴	다음주 주일부터 일시정지해 줄 수 있니?				
intent_일시정지_문의_멀티턴	다음주 토요일부터 일시중지 어떻게 해요?				
intent_일시정지_문의_멀티턴	다음주 토요일부터 일시중지 하는 법				
intent_일시정지_문의_멀티턴	다음주 토요일부터 정지될 수 있게 해 주세요				
intent_일시정지_문의_멀티턴	다음주 토요일에 일시정지 신청해서 한 달 유지해줘.				
intent_일시정지_문의_멀티턴	다음주 화요일 기준으로 일시정지 일주일만큼 하는 법 알려주세요				
intent_일시정지_문의_멀티턴	다음주 화요일날에 일시정지되게 할 수 있니?				
intent_일시정지_문의_멀티턴	다음주 화요일부터 가입 상품들 일시정지 시키려는데요				
intent_일시정지_문의_멀티턴	다음주 화요일부터 일시정지 가능하지?				
intent_일시정지_문의_멀티턴	다음주 화요일부터 일시정지 되게 신청합니다				
intent_일시정지_문의_멀티턴	다음주 화요일부터 일시정지 시작해도 돼?				
intent_일시정지_문의_멀티턴	다음주 화요일부터 일시중지 할 수 있을까요?				
intent_일시정지_문의_멀티턴	다음주부터 수요일에 일시정지되게 신청 가능한가요?				
intent_일시정지_문의_멀티턴	다음주부터 월요일에 일시정지 될 수 있도록 신청 부탁드립니다				
intent_일시정지_문의_멀티턴	다음주부터 화요일에 일시정지될 수 있도록 신청할 수 있나요?				
intent_일시정지_문의_멀티턴	담달 10일에 휴대전화 사용 잠시 중단하고 싶은데요	휴대전화	Mobile		
intent_일시정지_문의_멀티턴	담달 10일에 휴대전화 사용 잠시 중단하는 방법 안내해 줘요	휴대전화	Mobile		
intent_일시정지_문의_멀티턴	담달 10일에 휴대전화 사용 잠시 중단할 수 있어요?	휴대전화	Mobile		
intent_일시정지_문의_멀티턴	담달 10일에 휴대전화 일시 정지해줄 수 있어요?	휴대전화	Mobile		
intent_일시정지_문의_멀티턴	담달 10일에 휴대전화 일시 정지해줄래?	휴대전화	Mobile		
intent_일시정지_문의_멀티턴	담달 10일에 휴대전화 일시 정지해줘	휴대전화	Mobile		
intent_일시정지_문의_멀티턴	담달 10일에 휴대전화 일시 중지되도록 설정 도와주라	휴대전화	Mobile		
intent_일시정지_문의_멀티턴	담달 10일에 휴대전화 일시 중지되도록 설정 좀 해줘	휴대전화	Mobile		
intent_일시정지_문의_멀티턴	담달 13일부터 일시정지해줘				
intent_일시정지_문의_멀티턴	담달 1일부터 26일까지 폰 일시정지하자	폰	Mobile		
intent_일시정지_문의_멀티턴	담달 30일부터 핸드폰 한시적으로 정지하기	핸드폰	Mobile		
intent_일시정지_문의_멀티턴	담달 3일까지 핸드폰 정지 좀	핸드폰	Mobile		
intent_일시정지_문의_멀티턴	담달 보름까지 폰 정지하겠습니다	폰	Mobile		
intent_일시정지_문의_멀티턴	담달 첫주 금요일까지 일시정지 시켜줘				
intent_일시정지_문의_멀티턴	담달 첫주 금요일까지 일시정지 하는 법				
intent_일시정지_문의_멀티턴	담주 목요일까지 일시정지 하는 법 문의 좀 할게요				
intent_일시정지_문의_멀티턴	담주 목요일까지일시정지 좀 시켜주세요				
intent_일시정지_문의_멀티턴	담주 목욜부터 휴대전화 정지시키려면 뭘 해야 할까요?	휴대전화	Mobile		
intent_일시정지_문의_멀티턴	담주 목욜부터 휴대전화 정지시킬 수 있을까요?	휴대전화	Mobile		
intent_일시정지_문의_멀티턴	담주 목욜부터 휴대전화 정지시킬래요	휴대전화	Mobile		
intent_일시정지_문의_멀티턴	담주 월요일~금요일 일시정지 가능해?				
intent_일시정지_문의_멀티턴	담주 월요일까지 폰 정지 신청할게요	폰	Mobile		
intent_일시정지_문의_멀티턴	담주 월요일부터 폰 일시정지 시킬래	폰	Mobile		
intent_일시정지_문의_멀티턴	담주 월요일부터 폰 일시정지 하려고요	폰	Mobile		
intent_일시정지_문의_멀티턴	담주 월요일부터 폰 일시정지하려는데	폰	Mobile		
intent_일시정지_문의_멀티턴	담주 초까지 폰 정지해도 될까?	폰	Mobile		
intent_일시정지_문의_멀티턴	담주 토요일까지 핸드폰 정지하려고 하는데요	핸드폰	Mobile		
intent_일시정지_문의_멀티턴	담주 화까지 핸드폰 정지하는 법	핸드폰	Mobile		
intent_일시정지_문의_멀티턴	담주부터 일주일 일시정지 하려고요				
intent_일시정지_문의_멀티턴	돌아오는 수요일부터 일주일간 일시정지				
intent_일시정지_문의_멀티턴	돌아오는 일요일서부터 일시정지 시작해서 30일만큼 하는 법 알려주세요.				
intent_일시정지_문의_멀티턴	돌아오는 화요일부터 세 달만큼 일시정지 방법?				
intent_일시정지_문의_멀티턴	두달동안 일시정지 해줘요				
intent_일시정지_문의_멀티턴	두달동안 휴대폰을 일시정지 해줘요	휴대폰	Mobile		
intent_일시정지_문의_멀티턴	마지막주 금요일 기준으로 일시정지 해주고 2개월 후에 풀어줘.				
intent_일시정지_문의_멀티턴	모레까지 휴대폰 정지하고 싶어	휴대폰	Mobile		
intent_일시정지_문의_멀티턴	모레서부터 한 달 동안 폰 정지시켜주세요				
intent_일시정지_문의_멀티턴	반년 일시정지 해야하는데 어떻게 해?				
intent_일시정지_문의_멀티턴	반년간 일시정지 하고 싶어요				
intent_일시정지_문의_멀티턴	반년동안 일시정지 하고 싶은데 방법 알려줘				
intent_일시정지_문의_멀티턴	반년만큼 일시정지 하고 싶습니다				
intent_일시정지_문의_멀티턴	보름간 일시정지 할껀데 어떻게 하는지 모르겠어				
intent_일시정지_문의_멀티턴	보름동안 일시정지 하는 법				
intent_일시정지_문의_멀티턴	보름의 기간동안 일시정지 신청해줘				
intent_일시정지_문의_멀티턴	분실 때문에 일시정지 하려고요				
intent_일시정지_문의_멀티턴	분실 때문에 지금 일시정지 해야하는데				
intent_일시정지_문의_멀티턴	사용 상품 일시 정지 하는 방법				
intent_일시정지_문의_멀티턴	사용 정지 1월 1일인 다음주부터로 할 수 있나요?				
intent_일시정지_문의_멀티턴	사용 정지 1월 3일인 담주부터로 해 주세요				
intent_일시정지_문의_멀티턴	사용 정지 담주부터 1일로 할래요				
intent_일시정지_문의_멀티턴	사용 중인 상품 이용 중단 좀 잠깐 하려고요				
intent_일시정지_문의_멀티턴	사용 중인 상품들 일시 정지하고 싶어요				
intent_일시정지_문의_멀티턴	사용 중인 서비스 어디서 일시정지 신청해요?				
intent_일시정지_문의_멀티턴	사용 중인 회선 잠깐 동안 이용 정지하려면 어디서 신청하나요?				
intent_일시정지_문의_멀티턴	사용중인 서비스들 일시정지하는 것 좀 도와주세요				
intent_일시정지_문의_멀티턴	사용중인 요금제 일시 정지하려고 합니다				
intent_일시정지_문의_멀티턴	사주 일시정지 하고싶은데 어떻게 해?				
intent_일시정지_문의_멀티턴	사주일간 일시정지 신청해줄 수 있어?				
intent_일시정지_문의_멀티턴	삼일간 일시정지 하는 법				
intent_일시정지_문의_멀티턴	삼주일간 일시정지 하게 해줘				
intent_일시정지_문의_멀티턴	상품 일시 정지 방법 질문 드려요				
intent_일시정지_문의_멀티턴	상품 일시 정지 좀 부탁드리려고요				
intent_일시정지_문의_멀티턴	서비스 일시 정지하려고요				
intent_일시정지_문의_멀티턴	세달 일시정지 해야하는데 어떻게 하는지 알려줘요				
intent_일시정지_문의_멀티턴	세달 핸드폰 일시정지 해야하는데 어떻게 하는지 알려줘요	핸드폰	Mobile		
intent_일시정지_문의_멀티턴	수요일에서 일 년 일시정지 해줘.				
intent_일시정지_문의_멀티턴	시월 십일부터 일시정지 50일간 할 수 잇을까요?				
intent_일시정지_문의_멀티턴	십구일간 일시정지 할껀데 방법 쫌 알려줘				
intent_일시정지_문의_멀티턴	십사일동안 일시정지 하는 법 알려주십시오				
intent_일시정지_문의_멀티턴	십삼일간 일시정지 할껀데 어떻게 해?				
